{
  "project_code": "WX-YGJ",
  "work_item_id": "PT083",
  "generated_at": "2026-08-06T17:07:33",
  "generated_from": [
    "structured_prd/structured_prd.json",
    "analysis/reasoning_pack.json"
  ],
  "entries": [
    {
      "coverage_id": "COV-EX-0001",
      "coverage_type": "field_property",
      "source_origin": "explicit_rule",
      "source_type": "structured_field",
      "title": "云机画面尺寸 字段属性",
      "page_name": "需求介绍",
      "section_name": "云机质量及尺寸问题",
      "module_name": "云机技术与需求背景",
      "feature_name": "云机质量及尺寸问题",
      "field_name": "cloud_machine_resolution",
      "priority": "medium",
      "rationale": "字段 `云机画面尺寸` 已在 structured_prd 中显式建模，需要基础属性覆盖。",
      "planned_assertions": [
        "校验 `云机画面尺寸` 的控件类型、默认值或枚举定义与结构化规则一致。"
      ],
      "structured_refs": [
        "云机技术与需求背景.云机质量及尺寸问题.cloud_machine_resolution"
      ],
      "reasoning_refs": [],
      "coverage_level": "structural",
      "emit_mode": "audit_item"
    },
    {
      "coverage_id": "COV-EX-0002",
      "coverage_type": "field_property",
      "source_origin": "explicit_rule",
      "source_type": "structured_field",
      "title": "云机画面尺寸 字段属性",
      "page_name": "云机技术调整结论",
      "section_name": "SDK与画面尺寸调整",
      "module_name": "云机技术与需求背景",
      "feature_name": "SDK与画面尺寸调整",
      "field_name": "cloud_machine_resolution",
      "priority": "medium",
      "rationale": "字段 `云机画面尺寸` 已在 structured_prd 中显式建模，需要基础属性覆盖。",
      "planned_assertions": [
        "校验 `云机画面尺寸` 的控件类型、默认值或枚举定义与结构化规则一致。"
      ],
      "structured_refs": [
        "云机技术与需求背景.SDK与画面尺寸调整.cloud_machine_resolution"
      ],
      "reasoning_refs": [],
      "coverage_level": "structural",
      "emit_mode": "audit_item"
    },
    {
      "coverage_id": "COV-EX-0003",
      "coverage_type": "field_property",
      "source_origin": "explicit_rule",
      "source_type": "structured_field",
      "title": "云机版本Tab 字段属性",
      "page_name": "云挂机购买页",
      "section_name": "版本Tab",
      "module_name": "云挂机购买页",
      "feature_name": "版本Tab",
      "field_name": "cloud_machine_version",
      "priority": "medium",
      "rationale": "字段 `云机版本Tab` 已在 structured_prd 中显式建模，需要基础属性覆盖。",
      "planned_assertions": [
        "校验 `云机版本Tab` 的控件类型、默认值或枚举定义与结构化规则一致。"
      ],
      "structured_refs": [
        "云挂机购买页.版本Tab.cloud_machine_version"
      ],
      "reasoning_refs": [],
      "coverage_level": "structural",
      "emit_mode": "audit_item"
    },
    {
      "coverage_id": "COV-EX-0004",
      "coverage_type": "field_property",
      "source_origin": "explicit_rule",
      "source_type": "structured_field",
      "title": "宣传图片 字段属性",
      "page_name": "云挂机购买页",
      "section_name": "宣传图占位",
      "module_name": "云挂机购买页",
      "feature_name": "宣传图占位",
      "field_name": "promotion_image",
      "priority": "medium",
      "rationale": "字段 `宣传图片` 已在 structured_prd 中显式建模，需要基础属性覆盖。",
      "planned_assertions": [
        "校验 `宣传图片` 的控件类型、默认值或枚举定义与结构化规则一致。"
      ],
      "structured_refs": [
        "云挂机购买页.宣传图占位.promotion_image"
      ],
      "reasoning_refs": [],
      "coverage_level": "structural",
      "emit_mode": "audit_item"
    },
    {
      "coverage_id": "COV-EX-0005",
      "coverage_type": "field_property",
      "source_origin": "explicit_rule",
      "source_type": "structured_field",
      "title": "宣传口号 字段属性",
      "page_name": "云挂机购买页",
      "section_name": "宣传区",
      "module_name": "云挂机购买页",
      "feature_name": "宣传区",
      "field_name": "promotion_slogan",
      "priority": "medium",
      "rationale": "字段 `宣传口号` 已在 structured_prd 中显式建模，需要基础属性覆盖。",
      "planned_assertions": [
        "校验 `宣传口号` 的控件类型、默认值或枚举定义与结构化规则一致。"
      ],
      "structured_refs": [
        "云挂机购买页.宣传区.promotion_slogan"
      ],
      "reasoning_refs": [],
      "coverage_level": "structural",
      "emit_mode": "audit_item"
    },
    {
      "coverage_id": "COV-EX-0006",
      "coverage_type": "field_property",
      "source_origin": "explicit_rule",
      "source_type": "structured_field",
      "title": "性能参数 字段属性",
      "page_name": "云挂机购买页",
      "section_name": "宣传区",
      "module_name": "云挂机购买页",
      "feature_name": "宣传区",
      "field_name": "performance_parameters",
      "priority": "medium",
      "rationale": "字段 `性能参数` 已在 structured_prd 中显式建模，需要基础属性覆盖。",
      "planned_assertions": [
        "校验 `性能参数` 的控件类型、默认值或枚举定义与结构化规则一致。"
      ],
      "structured_refs": [
        "云挂机购买页.宣传区.performance_parameters"
      ],
      "reasoning_refs": [],
      "coverage_level": "structural",
      "emit_mode": "audit_item"
    },
    {
      "coverage_id": "COV-EX-0007",
      "coverage_type": "field_property",
      "source_origin": "explicit_rule",
      "source_type": "structured_field",
      "title": "特殊区商品列表 字段属性",
      "page_name": "云挂机购买页",
      "section_name": "特价专区",
      "module_name": "云挂机购买页",
      "feature_name": "特价专区",
      "field_name": "special_product_list",
      "priority": "medium",
      "rationale": "字段 `特殊区商品列表` 已在 structured_prd 中显式建模，需要基础属性覆盖。",
      "planned_assertions": [
        "校验 `特殊区商品列表` 的控件类型、默认值或枚举定义与结构化规则一致。"
      ],
      "structured_refs": [
        "云挂机购买页.特价专区.special_product_list"
      ],
      "reasoning_refs": [],
      "coverage_level": "structural",
      "emit_mode": "audit_item"
    },
    {
      "coverage_id": "COV-EX-0008",
      "coverage_type": "conditional_visibility",
      "source_origin": "explicit_rule",
      "source_type": "structured_rule",
      "title": "特殊区商品列表 条件展示",
      "page_name": "云挂机购买页",
      "section_name": "特价专区",
      "module_name": "云挂机购买页",
      "feature_name": "特价专区",
      "field_name": "special_product_list",
      "priority": "high",
      "rationale": "`特殊区商品列表` 已显式落出 `visible_when`。",
      "planned_assertions": [
        "仅当 `后台未配置特殊区商品时隐藏` 时展示 `特殊区商品列表`。"
      ],
      "structured_refs": [
        "云挂机购买页.特价专区.special_product_list.visible_when"
      ],
      "reasoning_refs": [],
      "coverage_level": "critical",
      "emit_mode": "main_testcase"
    },
    {
      "coverage_id": "COV-EX-0009",
      "coverage_type": "data_source_display",
      "source_origin": "explicit_rule",
      "source_type": "structured_field",
      "title": "特殊区商品列表 数据源展示格式",
      "page_name": "云挂机购买页",
      "section_name": "特价专区",
      "module_name": "云挂机购买页",
      "feature_name": "特价专区",
      "field_name": "special_product_list",
      "priority": "medium",
      "rationale": "`特殊区商品列表` 的候选项展示格式已在结构层保留。",
      "planned_assertions": [
        "`特殊区商品列表` 候选项展示应包含 `商品名称`。"
      ],
      "structured_refs": [
        "云挂机购买页.特价专区.special_product_list.content_values"
      ],
      "reasoning_refs": [],
      "coverage_level": "structural",
      "emit_mode": "audit_item"
    },
    {
      "coverage_id": "COV-EX-0010",
      "coverage_type": "field_property",
      "source_origin": "explicit_rule",
      "source_type": "structured_field",
      "title": "普通区商品列表 字段属性",
      "page_name": "云挂机购买页",
      "section_name": "普通商品列表",
      "module_name": "云挂机购买页",
      "feature_name": "普通商品列表",
      "field_name": "regular_product_list",
      "priority": "medium",
      "rationale": "字段 `普通区商品列表` 已在 structured_prd 中显式建模，需要基础属性覆盖。",
      "planned_assertions": [
        "校验 `普通区商品列表` 的控件类型、默认值或枚举定义与结构化规则一致。"
      ],
      "structured_refs": [
        "云挂机购买页.普通商品列表.regular_product_list"
      ],
      "reasoning_refs": [],
      "coverage_level": "structural",
      "emit_mode": "audit_item"
    },
    {
      "coverage_id": "COV-EX-0011",
      "coverage_type": "data_source_display",
      "source_origin": "explicit_rule",
      "source_type": "structured_field",
      "title": "普通区商品列表 数据源展示格式",
      "page_name": "云挂机购买页",
      "section_name": "普通商品列表",
      "module_name": "云挂机购买页",
      "feature_name": "普通商品列表",
      "field_name": "regular_product_list",
      "priority": "medium",
      "rationale": "`普通区商品列表` 的候选项展示格式已在结构层保留。",
      "planned_assertions": [
        "`普通区商品列表` 候选项展示应包含 `商品名称`。"
      ],
      "structured_refs": [
        "云挂机购买页.普通商品列表.regular_product_list.content_values"
      ],
      "reasoning_refs": [],
      "coverage_level": "structural",
      "emit_mode": "audit_item"
    },
    {
      "coverage_id": "COV-EX-0012",
      "coverage_type": "field_property",
      "source_origin": "explicit_rule",
      "source_type": "structured_field",
      "title": "云手机商品类型 字段属性",
      "page_name": "盒子管理后台-云手机商品管理",
      "section_name": "云手机商品类型筛选",
      "module_name": "云手机商品管理",
      "feature_name": "云手机商品类型筛选",
      "field_name": "cloud_phone_product_type",
      "priority": "medium",
      "rationale": "字段 `云手机商品类型` 已在 structured_prd 中显式建模，需要基础属性覆盖。",
      "planned_assertions": [
        "校验 `云手机商品类型` 的控件类型、默认值或枚举定义与结构化规则一致。"
      ],
      "structured_refs": [
        "云手机商品管理.云手机商品类型筛选.cloud_phone_product_type"
      ],
      "reasoning_refs": [],
      "coverage_level": "structural",
      "emit_mode": "audit_item"
    },
    {
      "coverage_id": "COV-EX-0013",
      "coverage_type": "field_property",
      "source_origin": "explicit_rule",
      "source_type": "structured_field",
      "title": "商品列表列 字段属性",
      "page_name": "盒子管理后台-云手机商品管理",
      "section_name": "商品列表",
      "module_name": "云手机商品管理",
      "feature_name": "商品列表",
      "field_name": "product_list_columns",
      "priority": "medium",
      "rationale": "字段 `商品列表列` 已在 structured_prd 中显式建模，需要基础属性覆盖。",
      "planned_assertions": [
        "校验 `商品列表列` 的控件类型、默认值或枚举定义与结构化规则一致。"
      ],
      "structured_refs": [
        "云手机商品管理.商品列表.product_list_columns"
      ],
      "reasoning_refs": [],
      "coverage_level": "structural",
      "emit_mode": "audit_item"
    },
    {
      "coverage_id": "COV-EX-0014",
      "coverage_type": "field_property",
      "source_origin": "explicit_rule",
      "source_type": "structured_field",
      "title": "商品编辑字段集合 字段属性",
      "page_name": "盒子管理后台-云手机商品管理",
      "section_name": "商品编辑弹窗",